{
  "schema_version": "2.0",
  "record_id": "aar-session-golden-aaaaaaaaaaaa",
  "product_name": "Peace OS: Crisis Room",
  "product_version": "0.3.0-rc2",
  "application_version": "0.3.0-rc2",
  "policy_version": "0.3.0-rc2",
  "scoring_version": "0.3.0-rc2",
  "scenario_id": "scenario_01_viral_collision_video",
  "scenario_version": "0.3.0-rc2",
  "mode": "practice",
  "session_id": "session-golden",
  "started_at": "2026-08-04T00:00:00Z",
  "committed_at": "2026-08-04T00:10:00Z",
  "decision_record": {"actions": {}},
  "score": 100,
  "score_breakdown": {},
  "performance_label": "Strong doctrine alignment",
  "governance_indicators": {},
  "evidence_diagnostics": {},
  "decision_digest": "aaaaaaaaaaaaaaaaaaaaaaaaaaaaaaaaaaaaaaaaaaaaaaaaaaaaaaaaaaaaaaaa",
  "confirmed_digest": "aaaaaaaaaaaaaaaaaaaaaaaaaaaaaaaaaaaaaaaaaaaaaaaaaaaaaaaaaaaaaaaa",
  "digest_algorithm": "sha256",
  "canonicalization_version": "1.0",
  "human_final_confirmation": true,
  "audit_events": [{
    "schema_version": "1.0",
    "sequence": 1,
    "event_type": "session_started",
    "occurred_at": "2026-08-04T00:00:00Z",
    "data": {},
    "previous_hash": "0000000000000000000000000000000000000000000000000000000000000000",
    "event_hash": "bbbbbbbbbbbbbbbbbbbbbbbbbbbbbbbbbbbbbbbbbbbbbbbbbbbbbbbbbbbbbbbb"
  }],
  "audit_chain_valid": true,
  "audit_limit": "This local hash-linked record is unsigned, not independently anchored, and does not prove identity or real-world timing.",
  "action_budget": {"time": 6, "authority": 4},
  "action_costs": {"time": 5, "authority": 4},
  "limitations": ["Fictional", "Unsigned", "Not independently timestamped", "Not externally anchored"]
}
